{
  "schema_version": "1.0",
  "registry_id": "runtime-config",
  "exception_rules": ["runtime-direct-reader"],
  "keys": [
    { "key": "SERVER_ADDR", "owner": "platform/config", "sensitivity": "public", "lifecycle": "active", "allowed_lanes": [], "readers": [{ "path": "apps/server_core/internal/platform/config/config.go", "kind": "typed", "status": "approved" }, { "path": "docker/dev/backend-entrypoint.sh", "kind": "edge", "status": "approved" }] },
    { "key": "API_PORT", "owner": "platform/config", "sensitivity": "public", "lifecycle": "active", "allowed_lanes": [], "readers": [{ "path": "apps/server_core/internal/platform/config/config.go", "kind": "typed", "status": "approved" }, { "path": "docker/dev/backend-entrypoint.sh", "kind": "edge", "status": "approved" }] },
    { "key": "MC_DATABASE_URL", "owner": "platform/pgdb", "sensitivity": "secret", "lifecycle": "active", "allowed_lanes": ["provider-write"], "readers": [{ "path": "apps/server_core/internal/platform/pgdb/config.go", "kind": "typed", "status": "approved" }, { "path": "scripts/lib/dev-local-runtime.ps1", "kind": "edge", "status": "approved" }, { "path": "docs/research/probes/run_ml_official_durable_price_probe.ps1", "kind": "edge", "status": "approved" }] },
    { "key": "MC_DEFAULT_TENANT_ID", "owner": "platform/pgdb", "sensitivity": "internal", "lifecycle": "active", "allowed_lanes": ["provider-write"], "readers": [{ "path": "apps/server_core/internal/platform/pgdb/config.go", "kind": "typed", "status": "approved" }] },
    { "key": "MPC_ENCRYPTION_KEY", "owner": "platform/pgdb", "sensitivity": "secret", "lifecycle": "active", "allowed_lanes": ["provider-write"], "readers": [{ "path": "apps/server_core/internal/platform/pgdb/config.go", "kind": "typed", "status": "approved" }] },
    { "key": "RUN_MIGRATIONS", "owner": "docker/dev", "sensitivity": "public", "lifecycle": "active", "allowed_lanes": ["integration"], "readers": [{ "path": "docker/dev/backend-entrypoint.sh", "kind": "edge", "status": "approved" }] },
    { "key": "MPC_ORACLE_USERNAME", "owner": "internal_read/adapters/oracle", "sensitivity": "internal", "lifecycle": "active", "allowed_lanes": ["live-oracle"], "readers": [{ "path": "apps/server_core/internal/modules/internal_read/adapters/oracle/config.go", "kind": "typed", "status": "approved" }, { "path": "scripts/harness/Environment.psm1", "kind": "registry", "status": "approved" }, { "path": "docker/dev/backend-entrypoint.sh", "kind": "edge", "status": "approved" }] },
    { "key": "MPC_ORACLE_PASSWORD", "owner": "internal_read/adapters/oracle", "sensitivity": "secret", "lifecycle": "active", "allowed_lanes": ["live-oracle"], "readers": [{ "path": "apps/server_core/internal/modules/internal_read/adapters/oracle/config.go", "kind": "typed", "status": "approved" }, { "path": "scripts/harness/Environment.psm1", "kind": "registry", "status": "approved" }, { "path": "docker/dev/backend-entrypoint.sh", "kind": "edge", "status": "approved" }] },
    { "key": "MPC_ORACLE_CONNECT_STRING", "owner": "internal_read/adapters/oracle", "sensitivity": "secret", "lifecycle": "active", "allowed_lanes": ["live-oracle"], "readers": [{ "path": "apps/server_core/internal/modules/internal_read/adapters/oracle/config.go", "kind": "typed", "status": "approved" }, { "path": "scripts/harness/Environment.psm1", "kind": "registry", "status": "approved" }, { "path": "docker/dev/backend-entrypoint.sh", "kind": "edge", "status": "approved" }] },
    { "key": "MPC_ORACLE_LIB_DIR", "owner": "internal_read/adapters/oracle", "sensitivity": "internal", "lifecycle": "active", "allowed_lanes": ["live-oracle"], "readers": [{ "path": "apps/server_core/internal/modules/internal_read/adapters/oracle/config.go", "kind": "typed", "status": "approved" }, { "path": "scripts/harness/Environment.psm1", "kind": "registry", "status": "approved" }, { "path": "docker/dev/backend-entrypoint.sh", "kind": "edge", "status": "approved" }] },
    { "key": "MPC_ORACLE_POOL_MIN_SESSIONS", "owner": "internal_read/adapters/oracle", "sensitivity": "public", "lifecycle": "active", "allowed_lanes": ["live-oracle"], "readers": [{ "path": "apps/server_core/internal/modules/internal_read/adapters/oracle/config.go", "kind": "typed", "status": "approved" }, { "path": "scripts/harness/Environment.psm1", "kind": "registry", "status": "approved" }] },
    { "key": "MPC_ORACLE_POOL_MAX_SESSIONS", "owner": "internal_read/adapters/oracle", "sensitivity": "public", "lifecycle": "active", "allowed_lanes": ["live-oracle"], "readers": [{ "path": "apps/server_core/internal/modules/internal_read/adapters/oracle/config.go", "kind": "typed", "status": "approved" }, { "path": "scripts/harness/Environment.psm1", "kind": "registry", "status": "approved" }] },
    { "key": "MPC_ORACLE_POOL_INCREMENT", "owner": "internal_read/adapters/oracle", "sensitivity": "public", "lifecycle": "active", "allowed_lanes": ["live-oracle"], "readers": [{ "path": "apps/server_core/internal/modules/internal_read/adapters/oracle/config.go", "kind": "typed", "status": "approved" }, { "path": "scripts/harness/Environment.psm1", "kind": "registry", "status": "approved" }] },
    { "key": "MPC_ORACLE_POOL_WAIT_TIMEOUT", "owner": "internal_read/adapters/oracle", "sensitivity": "public", "lifecycle": "active", "allowed_lanes": ["live-oracle"], "readers": [{ "path": "apps/server_core/internal/modules/internal_read/adapters/oracle/config.go", "kind": "typed", "status": "approved" }, { "path": "scripts/harness/Environment.psm1", "kind": "registry", "status": "approved" }] },
    { "key": "MPC_ORACLE_SESSION_TIMEOUT", "owner": "internal_read/adapters/oracle", "sensitivity": "public", "lifecycle": "active", "allowed_lanes": ["live-oracle"], "readers": [{ "path": "apps/server_core/internal/modules/internal_read/adapters/oracle/config.go", "kind": "typed", "status": "approved" }, { "path": "scripts/harness/Environment.psm1", "kind": "registry", "status": "approved" }] },
    { "key": "MPC_ORACLE_SESSION_MAX_LIFETIME", "owner": "internal_read/adapters/oracle", "sensitivity": "public", "lifecycle": "active", "allowed_lanes": ["live-oracle"], "readers": [{ "path": "apps/server_core/internal/modules/internal_read/adapters/oracle/config.go", "kind": "typed", "status": "approved" }, { "path": "scripts/harness/Environment.psm1", "kind": "registry", "status": "approved" }] },
    { "key": "MPC_ORACLE_CONNECT_TIMEOUT", "owner": "internal_read/adapters/oracle", "sensitivity": "public", "lifecycle": "active", "allowed_lanes": ["live-oracle"], "readers": [{ "path": "apps/server_core/internal/modules/internal_read/adapters/oracle/config.go", "kind": "typed", "status": "approved" }, { "path": "scripts/harness/Environment.psm1", "kind": "registry", "status": "approved" }] },
    { "key": "MPC_ORACLE_CALL_TIMEOUT", "owner": "internal_read/adapters/oracle", "sensitivity": "public", "lifecycle": "active", "allowed_lanes": ["live-oracle"], "readers": [{ "path": "apps/server_core/internal/modules/internal_read/adapters/oracle/config.go", "kind": "typed", "status": "approved" }, { "path": "scripts/harness/Environment.psm1", "kind": "registry", "status": "approved" }] },
    { "key": "MPC_ORACLE_BOOTSTRAP_TIMEOUT", "owner": "internal_read/adapters/oracle", "sensitivity": "public", "lifecycle": "active", "allowed_lanes": ["live-oracle"], "readers": [{ "path": "apps/server_core/internal/modules/internal_read/adapters/oracle/config.go", "kind": "typed", "status": "approved" }, { "path": "scripts/harness/Environment.psm1", "kind": "registry", "status": "approved" }] },
    { "key": "MPC_ASSISTED_SANKHYA_LINKAGE_ENABLED", "owner": "internal_read/adapters/oracle", "sensitivity": "public", "lifecycle": "active", "allowed_lanes": ["live-oracle"], "readers": [{ "path": "apps/server_core/internal/modules/internal_read/adapters/oracle/sankhya_linkage_config.go", "kind": "typed", "status": "approved" }] },
    { "key": "MPC_ASSISTED_SANKHYA_LINKAGE_SCHEMA", "owner": "internal_read/adapters/oracle", "sensitivity": "internal", "lifecycle": "active", "allowed_lanes": ["live-oracle"], "readers": [{ "path": "apps/server_core/internal/modules/internal_read/adapters/oracle/sankhya_linkage_config.go", "kind": "typed", "status": "approved" }] },
    { "key": "MPC_ASSISTED_SANKHYA_LINKAGE_HEADER_FIELD", "owner": "internal_read/adapters/oracle", "sensitivity": "internal", "lifecycle": "active", "allowed_lanes": ["live-oracle"], "readers": [{ "path": "apps/server_core/internal/modules/internal_read/adapters/oracle/sankhya_linkage_config.go", "kind": "typed", "status": "approved" }] },
    { "key": "MPC_ASSISTED_SANKHYA_LINKAGE_CONFIGURATION_REVISION", "owner": "internal_read/adapters/oracle", "sensitivity": "internal", "lifecycle": "active", "allowed_lanes": ["live-oracle"], "readers": [{ "path": "apps/server_core/internal/modules/internal_read/adapters/oracle/sankhya_linkage_config.go", "kind": "typed", "status": "approved" }] },
    { "key": "MPC_ASSISTED_SANKHYA_LINKAGE_UNIQUENESS_ATTESTATION_ID", "owner": "internal_read/adapters/oracle", "sensitivity": "internal", "lifecycle": "active", "allowed_lanes": ["live-oracle"], "readers": [{ "path": "apps/server_core/internal/modules/internal_read/adapters/oracle/sankhya_linkage_config.go", "kind": "typed", "status": "approved" }] },
    { "key": "MPC_ASSISTED_SANKHYA_LINKAGE_CANDIDATE_LIMIT", "owner": "internal_read/adapters/oracle", "sensitivity": "public", "lifecycle": "active", "allowed_lanes": ["live-oracle"], "readers": [{ "path": "apps/server_core/internal/modules/internal_read/adapters/oracle/sankhya_linkage_config.go", "kind": "typed", "status": "approved" }] },
    { "key": "MPC_ASSISTED_SANKHYA_LINKAGE_CANDIDATE_LINE_LIMIT", "owner": "internal_read/adapters/oracle", "sensitivity": "public", "lifecycle": "active", "allowed_lanes": ["live-oracle"], "readers": [{ "path": "apps/server_core/internal/modules/internal_read/adapters/oracle/sankhya_linkage_config.go", "kind": "typed", "status": "approved" }] },